overall_rank,rank,model,auc_mean,auc_std,accuracy_mean,accuracy_std,precision_mean,precision_std,recall_mean,recall_std,f1_mean,f1_std,n_splits,notes,imputation_method
1,1,Transformer,0.7605,0.194,0.764,0.1095,0.3427,0.2999,0.4472,0.4072,0.3588,0.3011,6,hybrid_adaptive scenario from transformer_summary.csv,hybrid_adaptive
2,2,Ensemble (weighted_avg),0.7346,0.1582,0.7979,0.1509,0.7791,0.3466,0.24,0.2598,0.3241,0.302,6,"Best ensemble strategy by AUC, then F1, then Recall across 6 common splits",hybrid_adaptive
3,3,LSTM,0.7323,0.2406,0.7809,0.1533,0.4511,0.3056,0.3175,0.3681,0.5947,0.1837,6,Splits 1-6 of 6 rolling-origin yearly splits,hybrid_adaptive
4,4,GRU,0.7155,0.1813,0.7884,0.1472,0.633,0.17,0.4111,0.3774,0.6367,0.1579,6,Splits 1-6 of 6 rolling-origin yearly splits,hybrid_adaptive
5,5,XGBoost (Hybrid: Gap-Type Adaptive),0.7037,0.1193,0.4979,0.1162,0.2809,0.1291,0.7283,0.2144,0.3925,0.157,6,Hybrid-adaptive XGBoost notebook evaluation across 6 temporal splits,hybrid_adaptive
